Päivämäärä, Sää, Ylin, Alin, Tuuli
Su 25.4.,Pilvistä, ajoittaista räntäsadetta,+2°,+2°,6 m/s
Ma 26.4.,Melko pilvistä ja poutaa,+5°,-3°,4 m/s
Ti 27.4.,Puolipilvistä, mahdollisesti vähäistä räntäsadetta ,+4°,-4°,4 m/s
Ke 28.4.,Melko pilvistä, mahdollisesti vähäistä räntäsadetta,+4°,-5°,3 m/s
To 29.4.,Puolipilvistä, mahdollisesti vähäistä sadetta,+5°,-5°,4 m/s
Pe 30.4.,Puolipilvistä ja poutaa,+5°,-3°,4 m/s
La 1.5.,Puolipilvistä ja poutaa,+5°,-5°,3 m/s
Su 2.5.,Puolipilvistä ja poutaa,+5°,-4°,4 m/s
Ma 3.5.,Melko pilvistä, mahdollisesti vähäistä sadetta,+6°,-4°,3 m/s
Ti 4.5.,Melko pilvistä, mahdollisesti vähäistä sadetta,+7°,-3°,3 m/s
