Päivämäärä, Sää, Ylin, Alin, Tuuli
Ke 5.5.,Melko pilvistä, mahdollisesti vähäistä sadetta,+6°,+6°,4 m/s
To 6.5.,Pilvistä, ajoittaista sadetta,+5°,-2°,5 m/s
Pe 7.5.,Pilvistä, ajoittaista räntäsadetta,+3°,-1°,5 m/s
La 8.5.,Melkein selkeää ja poutaa,+8°,-2°,3 m/s
Su 9.5.,Puolipilvistä, mahdollisesti vähäistä sadetta,+11°,-2°,3 m/s
Ma 10.5.,Pilvistä, ajoittaista sadetta,+10°,+10°,3 m/s
Ti 11.5.,Melko pilvistä ja poutaa,+19°,+19°,6 m/s
Ke 12.5.,Melkein selkeää ja poutaa,+21°,+21°,4 m/s
To 13.5.,Melkein selkeää ja poutaa,+20°,+20°,3 m/s
Pe 14.5.,Puolipilvistä ja poutaa,+18°,+18°,3 m/s
