Päivämäärä, Sää, Ylin, Alin, Tuuli
Ti 18.5.,Melko pilvistä ja poutaa,+19°,+19°,3 m/s
Ke 19.5.,Pilvistä, runsasta sadetta,+11°,+11°,4 m/s
To 20.5.,Puolipilvistä, mahdollisesti vähäistä sadetta,+15°,+15°,5 m/s
Pe 21.5.,Pilvistä, ajoittaista sadetta,+7°,+7°,5 m/s
La 22.5.,Melko pilvistä ja poutaa,+13°,+13°,4 m/s
Su 23.5.,Pilvistä, ajoittaista sadetta,+11°,+11°,5 m/s
Ma 24.5.,Pilvistä, mahdollisesti vähäistä sadetta,+12°,+12°,2 m/s
Ti 25.5.,Melko pilvistä, ajoittaista sadetta,+14°,+14°,2 m/s
Ke 26.5.,Melko pilvistä, ajoittaista sadetta,+13°,+13°,2 m/s
To 27.5.,Pilvistä, ajoittaista sadetta,+12°,+12°,4 m/s
