Päivämäärä, Sää, Ylin, Alin, Tuuli
To 8.7.,Puolipilvistä, mahdollisesti vähäistä sadetta,+26°,+26°,5 m/s
Pe 9.7.,Puolipilvistä ja poutaa,+27°,+27°,3 m/s
La 10.7.,Melko pilvistä ja poutaa,+27°,+27°,4 m/s
Su 11.7.,Melko pilvistä, ukkosta,+25°,+25°,2 m/s
Ma 12.7.,Melko pilvistä, ajoittaista sadetta,+25°,+25°,3 m/s
Ti 13.7.,Melkein selkeää ja poutaa,+26°,+26°,4 m/s
Ke 14.7.,Melko pilvistä ja poutaa,+26°,+26°,3 m/s
To 15.7.,Puolipilvistä ja poutaa,+26°,+26°,3 m/s
Pe 16.7.,Puolipilvistä, mahdollisesti vähäistä sadetta,+24°,+24°,2 m/s
