Päivämäärä, Sää, Ylin, Alin, Tuuli
Su 11.7.,Puolipilvistä, mahdollisesti vähäistä sadetta,+30°,+30°,4 m/s
Ma 12.7.,Puolipilvistä, mahdollisesti vähäistä sadetta,+27°,+27°,4 m/s
Ti 13.7.,Puolipilvistä ja poutaa,+26°,+26°,2 m/s
Ke 14.7.,Puolipilvistä ja poutaa,+27°,+27°,2 m/s
To 15.7.,Puolipilvistä, mahdollisesti vähäistä sadetta,+28°,+28°,4 m/s
Pe 16.7.,Melko pilvistä, ukkosta,+25°,+25°,5 m/s
La 17.7.,Melko pilvistä ja poutaa,+22°,+22°,4 m/s
Su 18.7.,Melko pilvistä, ajoittaista sadetta,+21°,+21°,4 m/s
Ma 19.7.,Melkein selkeää ja poutaa,+21°,+21°,3 m/s
Ti 20.7.,Puolipilvistä, ajoittain sadetta,+22°,+22°,6 m/s
