Päivämäärä, Sää, Ylin, Alin, Tuuli
Pe 7.5.,Pilvistä, runsasta lumisadetta,+1°,+1°,5 m/s
La 8.5.,Melkein selkeää ja poutaa,+5°,+5°,3 m/s
Su 9.5.,Selkeää ja poutaa,+6°,-1°,3 m/s
Ma 10.5.,Melko pilvistä ja poutaa,+8°,+8°,2 m/s
Ti 11.5.,Melko pilvistä, mahdollisesti vähäistä sadetta,+11°,+11°,4 m/s
Ke 12.5.,Melko pilvistä, mahdollisesti vähäistä sadetta,+14°,+14°,3 m/s
To 13.5.,Melkein selkeää ja poutaa,+16°,+16°,3 m/s
Pe 14.5.,Puolipilvistä, ajoittain sadetta,+17°,+17°,3 m/s
La 15.5.,Melko pilvistä, ajoittaista sadetta,+13°,+13°,4 m/s
Su 16.5.,Puolipilvistä, ajoittain sadetta,+10°,+10°,4 m/s
