Päivämäärä, Sää, Ylin, Alin, Tuuli
Ti 11.5.,Melko pilvistä, ajoittaista sadetta,+14°,+14°,4 m/s
Ke 12.5.,Puolipilvistä ja poutaa,+21°,+21°,3 m/s
To 13.5.,Puolipilvistä, mahdollisesti vähäistä sadetta,+21°,+21°,3 m/s
Pe 14.5.,Melko pilvistä ja poutaa,+19°,+19°,3 m/s
La 15.5.,Pilvistä ja poutaa,+16°,+16°,4 m/s
Su 16.5.,Pilvistä ja poutaa,+12°,+12°,4 m/s
Ma 17.5.,Melko pilvistä, mahdollisesti vähäistä sadetta,+14°,+14°,3 m/s
Ti 18.5.,Pilvistä, runsasta sadetta,+14°,+14°,5 m/s
Ke 19.5.,Melko pilvistä ja poutaa,+13°,+13°,4 m/s
To 20.5.,Puolipilvistä, mahdollisesti vähäistä sadetta,+12°,+12°,5 m/s
