Päivämäärä, Sää, Ylin, Alin, Tuuli
Su 23.5.,Melko pilvistä ja poutaa,+10°,+10°,4 m/s
Ma 24.5.,Pilvistä, mahdollisesti vähäistä sadetta,+7°,+7°,3 m/s
Ti 25.5.,Melko pilvistä ja poutaa,+10°,+10°,2 m/s
Ke 26.5.,Melko pilvistä ja poutaa,+13°,+13°,6 m/s
To 27.5.,Pilvistä, ajoittaista sadetta,+12°,+12°,4 m/s
Pe 28.5.,Pilvistä, runsasta sadetta,+12°,+12°,3 m/s
La 29.5.,Pilvistä, ajoittaista sadetta,+12°,+12°,4 m/s
Su 30.5.,Pilvistä, ajoittaista sadetta,+12°,+12°,3 m/s
Ma 31.5.,Melkein selkeää ja poutaa,+14°,+14°,3 m/s
Ti 1.6.,Melko pilvistä, ajoittaista sadetta,+15°,+15°,5 m/s
